{
  "angles": {
    "ascendant": {
      "house": 1,
      "keywords": [
        "intensity",
        "transformation",
        "depth"
      ],
      "sign": "Scorpio"
    },
    "descendant": {
      "house": 7,
      "keywords": [
        "stability",
        "security",
        "patience"
      ],
      "sign": "Taurus"
    },
    "imum_coeli": {
      "house": 4,
      "keywords": [
        "innovation",
        "freedom",
        "originality"
      ],
      "sign": "Aquarius"
    },
    "midheaven": {
      "house": 10,
      "keywords": [
        "self-expression",
        "creativity",
        "radiance"
      ],
      "sign": "Leo"
    }
  },
  "chart": {
    "birth": {
      "datetime_utc": "1990-01-02T03:04:05+00:00",
      "location": "Paris, France"
    },
    "calculation": {
      "coordinates": "Geocentric",
      "house_system": "Placidus",
      "zodiac": "Tropical"
    },
    "hemisphere_emphasis": {
      "dominant_area": "Below horizon",
      "summary": "The chart has a stronger private or interior emphasis."
    },
    "sect": "Night chart",
    "type": "Natal chart"
  },
  "contract_version": "llm_projection_natal_v1",
  "core_identity": {
    "ascendant": {
      "importance": "high",
      "keywords": [
        "intensity",
        "transformation",
        "depth"
      ],
      "sign": "Scorpio"
    },
    "moon": {
      "conditions": [
        "Angular house",
        "Below horizon"
      ],
      "importance": "high",
      "keywords": [
        "compassion",
        "intuition",
        "imagination"
      ],
      "placement": {
        "house": {
          "number": 4,
          "theme": "Home"
        },
        "keywords": [],
        "motion": "Direct motion",
        "object": "Moon",
        "sign": "Pisces"
      }
    },
    "sun": {
      "conditions": [
        "Succedent house",
        "Below horizon"
      ],
      "importance": "high",
      "keywords": [
        "ambition",
        "discipline",
        "structure"
      ],
      "placement": {
        "house": {
          "number": 2,
          "theme": "Resources"
        },
        "keywords": [],
        "motion": "Direct motion",
        "object": "Sun",
        "sign": "Capricorn"
      }
    }
  },
  "dominant_themes": {
    "houses": [
      {
        "importance": "Very high",
        "number": 2,
        "supporting_factors": [
          "Sun in house",
          "Saturn in house",
          "Uranus in house"
        ],
        "theme": "Resources"
      }
    ],
    "objects": [
      {
        "importance": "High",
        "name": "Saturn",
        "supporting_factors": [
          "Strong placement",
          "Saturn in domicile",
          "Participant in dominant theme"
        ]
      },
      {
        "importance": "Moderate",
        "name": "Jupiter",
        "supporting_factors": [
          "Strong placement",
          "Jupiter in exaltation",
          "Involved in a strong major aspect"
        ]
      }
    ],
    "signs": [
      {
        "importance": "Very high",
        "keywords": [
          "ambition",
          "discipline",
          "structure"
        ],
        "name": "Capricorn",
        "supporting_factors": [
          "Sun in sign",
          "Mercury in sign",
          "Saturn in sign"
        ]
      }
    ]
  },
  "dynamics": {
    "lunar_phase": {
      "cycle": "Waxing",
      "keywords": [
        "lunar phase",
        "sun moon cycle"
      ],
      "phase": "Waxing Crescent",
      "sun_moon_angle_degrees": 60.3098
    },
    "major_aspects": [
      {
        "aspect": "Jupiter opposition Uranus",
        "keywords": [
          "emotional sensitivity",
          "nurturing",
          "ambition"
        ],
        "objects": [
          "Jupiter",
          "Uranus"
        ],
        "orb_degrees": 0.76,
        "phase": "Separating",
        "quality": "Tension",
        "valence": "Polarizing"
      }
    ]
  },
  "house_axes": [
    {
      "axis": "Resources and Sharing",
      "balance": "Mainly house 2",
      "houses": [
        {
          "number": 2,
          "theme": "Resources"
        },
        {
          "number": 8,
          "theme": "Transformation"
        }
      ],
      "importance": "Very high",
      "summary": "Resources and Sharing is activated mainly through house 2 (Resources), with house 8 (Transformation) present as a secondary counterpoint.",
      "supporting_factors": [
        "Dominant house emphasis",
        "Sun in house",
        "Sun highlights this house"
      ]
    }
  ],
  "keywords": {
    "by_area": {
      "communication": [
        "ambition",
        "discipline",
        "structure"
      ],
      "dynamics": [
        "Jupiter opposition Uranus",
        "tension",
        "emotional sensitivity"
      ],
      "identity": [
        "expansion",
        "freedom",
        "adventure"
      ],
      "resources": [
        "ambition",
        "discipline",
        "structure"
      ],
      "roots": [
        "compassion",
        "intuition",
        "imagination"
      ],
      "shared_resources": [
        "emotional sensitivity",
        "nurturing",
        "protection"
      ]
    },
    "main": [
      "ambition",
      "discipline",
      "structure",
      "compassion",
      "intuition",
      "imagination"
    ]
  },
  "placements": {
    "background": [],
    "primary": [],
    "supporting": [
      {
        "conditions": [
          "Cadent house",
          "Below horizon"
        ],
        "house": {
          "number": 3,
          "theme": "Communication"
        },
        "importance": "high",
        "keywords": [
          "ambition",
          "discipline",
          "structure"
        ],
        "motion": "Retrograde motion",
        "object": "Mercury",
        "sign": "Capricorn"
      },
      {
        "conditions": [
          "Cadent house",
          "Below horizon"
        ],
        "house": {
          "number": 3,
          "theme": "Communication"
        },
        "importance": "high",
        "keywords": [
          "innovation",
          "freedom",
          "originality"
        ],
        "motion": "Retrograde motion",
        "object": "Venus",
        "sign": "Aquarius"
      },
      {
        "conditions": [
          "Angular house",
          "Below horizon"
        ],
        "house": {
          "number": 1,
          "theme": "Self"
        },
        "importance": "high",
        "keywords": [
          "expansion",
          "freedom",
          "adventure"
        ],
        "motion": "Direct motion",
        "object": "Mars",
        "sign": "Sagittarius"
      }
    ]
  },
  "projection_level": "compact",
  "projection_limits": {
    "effective_limits": {
      "include_accidental_dignities": false,
      "include_degrees": false,
      "include_minor_evidence": false,
      "include_rulership_context": false,
      "include_scores": false,
      "max_accidental_conditions_per_object": 2,
      "max_aspects": 1,
      "max_background_placements": 0,
      "max_core_placements": 3,
      "max_dominant_houses": 1,
      "max_dominant_objects": 2,
      "max_dominant_signs": 1,
      "max_house_axes": 1,
      "max_keywords_per_item": 3,
      "max_supporting_placements": 3
    },
    "level": "compact"
  },
  "reading_order": [
    {
      "focus": [
        "Sun in Capricorn, house 2",
        "Moon in Pisces, house 4",
        "Ascendant in Scorpio"
      ],
      "section": "Core identity"
    },
    {
      "focus": [
        "Capricorn emphasis",
        "House 2 resources emphasis",
        "Saturn strength"
      ],
      "section": "Dominant theme"
    },
    {
      "focus": [
        "Jupiter opposition Uranus"
      ],
      "section": "Main dynamic"
    },
    {
      "focus": [
        "Mercury in Capricorn, house 3",
        "Venus in Aquarius, house 3",
        "Mars in Sagittarius, house 1"
      ],
      "section": "Expression style"
    },
    {
      "focus": [
        "Midheaven in Leo",
        "Jupiter in Cancer, house 8",
        "Jupiter strongly placed in Cancer"
      ],
      "section": "Background factors"
    }
  ],
  "relationship_network": {},
  "strengths": {
    "accidental_conditions": [],
    "essential_dignities": [
      {
        "dignity": "Domicile",
        "meaning": "Strong functional expression",
        "object": "Saturn",
        "sign": "Capricorn"
      },
      {
        "dignity": "Exaltation",
        "meaning": "Constructive emphasis",
        "object": "Jupiter",
        "sign": "Cancer"
      }
    ]
  }
}
